用户ID,会员级别,手机参数,昵称,购买时间,评论内容
1.03556E+12,0,网络类型:无需合约版;机身颜色:深空灰色;套餐类型:官方标配;存储容量:64GB,乱***绝,2019/2/19 11:41,很好。正品。手机流畅。
1.03524E+12,0,网络类型:无需合约版;机身颜色:深空灰色;套餐类型:官方标配;存储容量:64GB,罗***i,2019/2/16 11:52,正品 用着不错 满意 物流很快 第二天就到了
1.03512E+12,0,网络类型:无需合约版;机身颜色:银色;套餐类型:官方标配;存储容量:64GB,a***0,2019/2/14 12:49,第四次购买了。自然很耐斯。
1.03515E+12,0,网络类型:无需合约版;机身颜色:深空灰色;套餐类型:官方标配;存储容量:64GB,小***7,2019/2/16 19:59,正品啊 没有什么问题 很好用 就是物流太慢了
1.03509E+12,0,网络类型:无需合约版;机身颜色:金色;套餐类型:官方标配;存储容量:64GB,s***1,2019/2/17 15:01,已经验证过是正品，不错，下次还来
1.03586E+12,0,网络类型:无需合约版;机身颜色:银色;套餐类型:官方标配;存储容量:64GB,h***4,2019/2/23 22:46,很喜欢??
1.03556E+12,0,网络类型:无需合约版;机身颜色:金色;套餐类型:官方标配;存储容量:64GB,e***杰,2019/2/20 18:47,非常喜欢
1.03529E+12,0,网络类型:无需合约版;机身颜色:深空灰色;套餐类型:官方标配;存储容量:64GB,r***6,2019/2/17 7:19,手机是正品快递也很快点赞??
1.03532E+12,0,网络类型:无需合约版;机身颜色:深空灰色;套餐类型:官方标配;存储容量:64GB,爱***9,2019/2/20 18:19,物流很给力
1.03545E+12,0,网络类型:无需合约版;机身颜色:金色;套餐类型:官方标配;存储容量:64GB,谁***你,2019/2/19 13:56,苏宁易购值得信赖叭～以下是一个换积分的好评模板。东西很好，价美物廉，谢谢掌柜的！说实在，这是我淘宝购物来让我最满意的一次购物。无论是掌柜的态度还是对物品，我都非常满意的。掌柜态度很专业热情，有问必答，回复也很快，我问了不少问题，他都不觉得烦，都会认真回答我，这点我向掌柜表示由衷的敬意，这样的好掌柜可不多。再说宝贝，正是我需要的，收到的时候包装完整，打开后让我惊喜的是，宝贝比我想象中的还要好！不得不得竖起大拇指。下次需要的时候我还会再来的，到时候麻烦掌柜给个优惠哦！
1.03528E+12,0,网络类型:无需合约版;机身颜色:深空灰色;套餐类型:官方标配;存储容量:64GB,s***8,2019/2/15 10:37,收到货已使用半个月，无故障，给好评，苏宁易购值得信赖
1.03508E+12,0,网络类型:无需合约版;机身颜色:银色;套餐类型:官方标配;存储容量:64GB,何***情,2019/2/17 13:11,昨天收到了苹果8，很好用，
1.0353E+12,0,网络类型:无需合约版;机身颜色:深空灰色;套餐类型:官方标配;存储容量:64GB,我***么,2019/2/17 10:03,手机不要太好看，是我喜欢的类型
1.03583E+12,0,网络类型:无需合约版;机身颜色:深空灰色;套餐类型:官方标配;存储容量:64GB,m***3,2019/2/23 14:10,物流很快，好评
1.03525E+12,0,网络类型:无需合约版;机身颜色:深空灰色;套餐类型:官方标配;存储容量:64GB,梦***3,2019/2/18 11:07,手机是正品？，放心购买吧！
1.03524E+12,0,网络类型:无需合约版;机身颜色:深空灰色;套餐类型:官方标配;存储容量:64GB,t***5,2019/2/19 20:24,手机很好，与描述相符，满意。
1.03517E+12,0,网络类型:无需合约版;机身颜色:金色;套餐类型:官方标配;存储容量:64GB,l***g,2019/2/17 9:50,还不错，查了是正品
1.03556E+12,0,网络类型:无需合约版;机身颜色:银色;套餐类型:官方标配;存储容量:64GB,飞***牟,2019/2/19 11:02,挺好的  是官方正品   全新    一点毛病没有   很好用   颜值高。
1.03488E+12,0,网络类型:无需合约版;机身颜色:银色;套餐类型:官方标配;存储容量:64GB,w***o,2019/2/14 12:14,刚收货 包装完整 日后再追评！
1.03515E+12,0,网络类型:无需合约版;机身颜色:金色;套餐类型:官方标配;存储容量:64GB,y***9,2019/2/14 20:49,手机很好 买的第三个手机了 都没有问题
1.03491E+12,0,网络类型:无需合约版;机身颜色:深空灰色;套餐类型:官方标配;存储容量:64GB,李***n,2019/2/14 18:31,用了两天感觉还不错。 先用着以后再过来追评吧
1.0352E+12,0,网络类型:无需合约版;机身颜色:金色;套餐类型:官方标配;存储容量:64GB,淘***了,2019/2/18 22:54,不错正品好用
1.03535E+12,0,网络类型:无需合约版;机身颜色:金色;套餐类型:官方标配;存储容量:64GB,不***7,2019/2/17 21:22,用了段时间才来评论  手机很好
1.03528E+12,0,网络类型:无需合约版;机身颜色:银色;套餐类型:官方标配;存储容量:64GB,m***4,2019/2/16 23:04,还不错是正品
1.03523E+12,0,网络类型:无需合约版;机身颜色:金色;套餐类型:官方标配;存储容量:64GB,无***旺,2019/2/17 23:13,非常好是正品
1.0353E+12,0,网络类型:无需合约版;机身颜色:深空灰色;套餐类型:官方标配;存储容量:64GB,我***牧,2019/2/15 15:50,三码合一 新品未激活  昨天买济南发货今天到 给力
1.03556E+12,0,网络类型:无需合约版;机身颜色:银色;套餐类型:官方标配;存储容量:64GB,长***要,2019/2/24 18:02,还可以     有手机壳送就好了
1.03508E+12,0,网络类型:无需合约版;机身颜色:金色;套餐类型:官方标配;存储容量:64GB,阿***9,2019/2/13 18:57,电话不错，用了一段时间才来评价，以前用惯安卓机现在还没用习惯
1.03502E+12,0,网络类型:无需合约版;机身颜色:深空灰色;套餐类型:官方标配;存储容量:64GB,微***心,2019/2/12 16:21,看了很长时间苹果手机的 然后前天购买的 今天才收到的  感觉手机是真的不错  非常好  物有所值  还行购物起来很好 第一次购买苏宁的产品 心情很美丽  希望店铺越做越好  新年快乐  万事如意！
1.03494E+12,0,网络类型:无需合约版;机身颜色:深空灰色;套餐类型:官方标配;存储容量:64GB,看***我,2019/2/13 14:00,还不错 非常流畅 祖传充电器 可以想象 蛮好的额 充满电可以用一整天 快递小哥服务很棒 还要我开箱验货 棒棒的
1.03619E+12,0,网络类型:无需合约版;机身颜色:深空灰色;套餐类型:官方标配;存储容量:64GB,c***7,2019/3/1 21:12,手机用了半个月了，真香！好评，为了积分凑够85字，也是拼了。好评，为了积分凑够85字，也是拼了。好评，为了积分凑够8 好评，为了积分凑够85字，也是拼了。 5字，也是拼了。好评，为了积分凑够85字，也是拼了。好评，为了积分凑够85字，也是拼了。
1.0351E+12,0,网络类型:无需合约版;机身颜色:深空灰色;套餐类型:官方标配;存储容量:64GB,努***l,2019/2/12 9:15,昨天刚刚到手感还可以，第一次在苏宁易购上买东西很满意，速度很快，，好评
1.03513E+12,0,网络类型:无需合约版;机身颜色:深空灰色;套餐类型:官方标配;存储容量:64GB,2***潇,2019/2/18 8:43,很好??，价格也是。正品
1.0356E+12,0,网络类型:无需合约版;机身颜色:深空灰色;套餐类型:官方标配;存储容量:64GB,m***0,2019/2/19 23:49,帮朋友买的以后在追加
1.03534E+12,0,网络类型:无需合约版;机身颜色:金色;套餐类型:官方标配;存储容量:64GB,陈***遒,2019/1/14 17:36,此用户没有填写评论!
1.03522E+12,0,网络类型:无需合约版;机身颜色:金色;套餐类型:官方标配;存储容量:64GB,t***8,2019/2/14 10:50,帮朋友买的 反应很快！
1.03516E+12,0,网络类型:无需合约版;机身颜色:金色;套餐类型:官方标配;存储容量:64GB,风***5,2019/2/17 2:49,一直忙，确认晚了，机子很不错，正，好评
1.03518E+12,0,网络类型:无需合约版;机身颜色:深空灰色;套餐类型:官方标配;存储容量:64GB,b***y,2019/2/18 17:12,哈哈哈哈哈哈哈哈哈哈哈哈哈哈哈哈哈哈哈哈哈哈哈哈哈哈哈哈哈哈哈哈哈哈呵呵呵呵不好意思打扰你们睡觉吧！哈哈哈哈哈哈哈哈刚果共和国哈哈哈哈哈刚果共和国红红火火恍恍惚惚好恍恍惚惚好好了恍恍惚惚好好恍恍惚惚好好，h
1.03605E+12,0,网络类型:无需合约版;机身颜色:金色;套餐类型:官方标配;存储容量:64GB,t***0,2019/3/3 9:53,正品，都买了几个了
1.03531E+12,0,网络类型:无需合约版;机身颜色:深空灰色;套餐类型:官方标配;存储容量:64GB,g***2,2019/2/18 22:39,好用，第一次用苹果，本来担心64g的会不够用，不过好像照我的用法，应该够够的，颜色也很满意，深空灰色的很大气耐看，非常喜欢呀
1.03554E+12,0,网络类型:无需合约版;机身颜色:深空灰色;套餐类型:官方标配;存储容量:64GB,枝***见,2019/2/24 15:00,没什么问题 买了两部手机了 在电脑上也查了
1.03506E+12,0,网络类型:无需合约版;机身颜色:金色;套餐类型:官方标配;存储容量:64GB,t***8,2019/2/17 1:43,正品好用
1.03522E+12,0,网络类型:无需合约版;机身颜色:金色;套餐类型:官方标配;存储容量:64GB,3***n,2019/2/19 12:48,一直用苹果手机     一如既往
1.03528E+12,0,网络类型:无需合约版;机身颜色:深空灰色;套餐类型:官方标配;存储容量:64GB,胡***5,2019/2/18 16:15,正品，儿子很满意！物流给力服务优质！
1.03516E+12,0,网络类型:无需合约版;机身颜色:深空灰色;套餐类型:官方标配;存储容量:64GB,泽***j,2019/2/16 22:25,很满意
1.03516E+12,0,网络类型:无需合约版;机身颜色:银色;套餐类型:官方标配;存储容量:64GB,t***4,2019/2/15 8:48,非常好！正品，五星好评！
1.03549E+12,0,网络类型:无需合约版;机身颜色:银色;套餐类型:官方标配;存储容量:64GB,f***2,2019/2/18 11:00,是正品，价格便宜。666
1.03418E+12,0,网络类型:无需合约版;机身颜色:深空灰色;套餐类型:官方标配;存储容量:64GB,仙***z,2019/2/2 1:25,不错不错，挺好用的，是正品，以后买机就来这里买，是我不二的选择。
1.03512E+12,0,网络类型:无需合约版;机身颜色:金色;套餐类型:官方标配;存储容量:64GB,t***6,2019/2/17 23:28,坐标深圳 先给个好评 手机全新原装 盒子序列码和手机一致 打电话问过官方客服 也确定没啥问题 激活时间是2月17 基本没问题 挺满意 因为之前在华强北买到过翻新机 一直很谨慎 所以多花几百去苏宁买也比较放心 客服也蛮热情 这个机子买的挺顺利 后续使用有什么问题再追加
1.0354E+12,0,网络类型:无需合约版;机身颜色:金色;套餐类型:官方标配;存储容量:64GB,我***金,2019/2/16 23:40,我想要的就是这款，很喜欢，物流也给力，早上下单，下午收货
1.0354E+12,0,网络类型:无需合约版;机身颜色:金色;套餐类型:官方标配;存储容量:64GB,小***子,2019/2/17 6:44,挺好的正品保证大家放心购买吧！
1.03522E+12,0,网络类型:无需合约版;机身颜色:银色;套餐类型:官方标配;存储容量:64GB,彩***o,2019/2/17 20:31,跟产品描述的一致，挺不错。
1.03456E+12,0,网络类型:无需合约版;机身颜色:深空灰色;套餐类型:官方标配;存储容量:64GB,t***2,2019/2/6 13:01,手机是正品，用了一段时间才来评价，已经多次光顾了，下次还会来的，
1.03525E+12,0,网络类型:无需合约版;机身颜色:银色;套餐类型:官方标配;存储容量:64GB,快***卞,2019/2/18 10:31,用着还不错。情人节送老婆的，很喜欢
1.03542E+12,0,网络类型:无需合约版;机身颜色:深空灰色;套餐类型:官方标配;存储容量:64GB,滨***1,2019/2/22 10:38,用一段时间在评论吧
1.03606E+12,0,网络类型:无需合约版;机身颜色:银色;套餐类型:官方标配;存储容量:64GB,默***水,2019/2/28 12:26,收到2星期来评价，挺好，没啥问题。我果然喜欢大屏幕手机。
1.03601E+12,0,网络类型:无需合约版;机身颜色:深空灰色;套餐类型:官方标配;存储容量:64GB,历***彬,2019/3/1 11:22,用了快一个月了，到货时用爱思助手验机没问题，沙漏也没问题，就是pp助手验机说生产日期异常，生产日期是19年一月份的，不过我还是继续用了，用到现在没发现什么毛病
1.03516E+12,0,网络类型:无需合约版;机身颜色:银色;套餐类型:官方标配;存储容量:64GB,q***封,2019/2/18 15:12,暂时用的还不错 用一段时间再来追评
1.0353E+12,0,网络类型:无需合约版;机身颜色:金色;套餐类型:官方标配;存储容量:64GB,g***6,2019/2/17 11:31,手机挺好，真心不错，
1.03576E+12,0,网络类型:无需合约版;机身颜色:银色;套餐类型:官方标配;存储容量:64GB,w***i,2019/2/22 10:21,反正用自己都在苏宁买手机iPad之类的，质量买了这么多年没啥问题的，赞一个吧
1.03609E+12,0,网络类型:无需合约版;机身颜色:金色;套餐类型:官方标配;存储容量:64GB,巾***8,2019/3/3 15:55,买过两次。不过还是第一次在网上买手机呢。用了快一个月了  哈可以呢。就是放音乐。有些噪音。跟卖家说了。也没给说明。可能8????都这样吧。电量哈可以。像素哈可以吧
1.03521E+12,0,网络类型:无需合约版;机身颜色:银色;套餐类型:官方标配;存储容量:64GB,零***0,2019/2/19 11:21,很喜欢这个手机
1.03491E+12,0,网络类型:无需合约版;机身颜色:银色;套餐类型:官方标配;存储容量:64GB,蘑***5,2019/2/12 19:18,客服人员很有耐心^o^速度一如既往的快！正品无疑，全五分好评哦～
1.03558E+12,0,网络类型:无需合约版;机身颜色:深空灰色;套餐类型:官方标配;存储容量:64GB,一***起,2019/2/19 17:05,孩子用的挺好的
1.035E+12,0,网络类型:无需合约版;机身颜色:金色;套餐类型:官方标配;存储容量:64GB,q***0,2019/2/16 11:03,买来送老婆的，正好情人节那天收到。快递小哥当面拆封验机，手机是国行正品，苏宁易购值得的信赖！
1.03493E+12,0,网络类型:无需合约版;机身颜色:银色;套餐类型:官方标配;存储容量:64GB,我***吗,2019/2/8 20:33,手机非常好 好用也好看 有耳机子 用着就没拍照 发货很快  快递也很快 春节这几天买的 第二天就到了 物流好评 手机非常快 一点也不卡 总之都很喜欢 棒
1.03538E+12,0,网络类型:无需合约版;机身颜色:深空灰色;套餐类型:官方标配;存储容量:64GB,严***u,2019/2/16 17:24,用了好几天才来评价的&hellip;还不错 目前没发现什么问题&hellip;好了性价比不错，推荐！ 这是一个好评模版，因为本仙女很懒，不想每个产 品都写评价，所以模仿网友写下这个模板，但是这 个宝贝无论是质量还是外形，都是本仙女喜欢的 如果不喜欢，本仙女就会很生气，然后这个模板就 会成为本仙女喋喋不休的怨气，自然也不会写下这个好评来自只爱购物不想写评语却还想Q积分的仙女！
1.03548E+12,0,网络类型:无需合约版;机身颜色:金色;套餐类型:官方标配;存储容量:64GB,戴***好,2019/2/19 21:33,正版，无激活。满分
1.03485E+12,0,网络类型:无需合约版;机身颜色:金色;套餐类型:官方标配;存储容量:64GB,v***n,2019/2/7 13:01,真的很喜欢，完全超出期望值，发货速度非常快，包装非常仔细、严实，物流公司服务态度很好，运送速度很快，很满意的一次购物。 听说好评必须85字？不然没有积分？但是每次都要写85字的评论又太费时间，所以只能编辑了这段文字，然后每次复制粘贴就搞定啦！
1.03525E+12,0,网络类型:无需合约版;机身颜色:深空灰色;套餐类型:官方标配;存储容量:64GB,温***的,2019/2/19 23:48,手机没问题 很满意    送货很快
1.03538E+12,0,网络类型:无需合约版;机身颜色:深空灰色;套餐类型:官方标配;存储容量:64GB,e***r,2019/2/16 19:01,很满意 手机很好
1.03462E+12,0,网络类型:无需合约版;机身颜色:金色;套餐类型:官方标配;存储容量:64GB,落***华,2019/2/7 13:32,已经在苏宁买了3只iPhone了 都很好 非常棒！！！速度也很快
1.03438E+12,0,网络类型:无需合约版;机身颜色:深空灰色;套餐类型:官方标配;存储容量:64GB,诺***晓,2019/2/3 11:01,用了一个星期才来评价，手机是原装正品未拆封未激活的国行，没有问题，性能就是苹果的性能不用我说，大家都懂的。苏宁还是值得信赖，发货快。过段时间我再来追评。
1.03535E+12,0,网络类型:无需合约版;机身颜色:银色;套餐类型:官方标配;存储容量:64GB,f***8,2019/2/17 22:44,上午买，下午就到货了，绝对正品
1.03504E+12,0,网络类型:无需合约版;机身颜色:金色;套餐类型:官方标配;存储容量:64GB,再***了,2019/2/15 9:57,速度很快，很满意。
1.03552E+12,0,网络类型:无需合约版;机身颜色:深空灰色;套餐类型:官方标配;存储容量:64GB,o***e,2019/2/18 17:49,还不错，用一段时间再追评
1.03558E+12,0,网络类型:无需合约版;机身颜色:银色;套餐类型:官方标配;存储容量:64GB,哈***呀,2019/2/23 9:46,让我对象在官网上查了序列号啥的 反正就是通过好多途径查了不同了东西 确认是正品 就放心了 我替他用了用 真的是比我的用着得劲多了 也想买来着 值！这是一个好评模版，因为本仙女很懒，不想每个产品都写好评，所以特地效仿一位网友写下了这个模版，但是这个产品不论是质量还是外形都深得本仙女心，如果不喜欢，仙女收到东西会很生气，然后这个模版就会涑杀鞠膳喋喋不体的抱怨书，自然不可能撤下这个好评，这里写下这么多给各位朋友一个参考，本物品还是极好的！好的东西自己会说话。
1.03544E+12,0,网络类型:无需合约版;机身颜色:金色;套餐类型:官方标配;存储容量:64GB,欧***湘,2019/2/19 8:37,还不错第一次苏宁买
1.03532E+12,0,网络类型:无需合约版;机身颜色:深空灰色;套餐类型:官方标配;存储容量:64GB,勒***0,2019/2/19 10:32,快递快。新机，满意。
1.03499E+12,0,网络类型:无需合约版;机身颜色:银色;套餐类型:官方标配;存储容量:64GB,忆***9,2019/2/9 21:42,不错不错，包装完好，官网查是正品，第一次用苹果手机，简约大方，运行速度很快，喜欢
1.03511E+12,0,网络类型:无需合约版;机身颜色:深空灰色;套餐类型:官方标配;存储容量:64GB,自***疼,2019/2/16 12:01,手机挺满意的
1.03534E+12,0,网络类型:无需合约版;机身颜色:金色;套餐类型:官方标配;存储容量:64GB,蓝***悔,2019/2/17 18:36,挺快的！东西真的！下次再来
1.03532E+12,0,网络类型:无需合约版;机身颜色:深空灰色;套餐类型:官方标配;存储容量:64GB,张***4,2019/2/19 12:46,非常好，非常贴心，产品很好，快递小哥很给力
1.03537E+12,0,网络类型:无需合约版;机身颜色:金色;套餐类型:官方标配;存储容量:64GB,金***8,2019/2/16 16:06,没问题，不错值得信赖
1.03491E+12,0,网络类型:无需合约版;机身颜色:深空灰色;套餐类型:官方标配;存储容量:64GB,l***平,2019/2/14 20:17,用了几天 很好 值得信赖
1.03516E+12,0,网络类型:无需合约版;机身颜色:深空灰色;套餐类型:官方标配;存储容量:64GB,j***9,2019/2/18 14:32,嘿嘿过年马大大抽奖中的手机，谢谢马云大大物流非常给力头一天下单第二天就到了
1.03516E+12,0,网络类型:无需合约版;机身颜色:深空灰色;套餐类型:官方标配;存储容量:64GB,离***店,2019/2/16 21:50,送给女票的   女票很喜欢很开心
1.03489E+12,0,网络类型:无需合约版;机身颜色:深空灰色;套餐类型:官方标配;存储容量:64GB,t***4,2019/2/12 15:49,快递相当的快，昨天下午下的订单，今天上午可到了，手机是正品，速度非常快，非常适合学生党，赞??，五星好评！！！
1.03537E+12,0,网络类型:无需合约版;机身颜色:深空灰色;套餐类型:官方标配;存储容量:64GB,q***6,2019/2/18 10:41,手机不错
1.03511E+12,0,网络类型:无需合约版;机身颜色:银色;套餐类型:官方标配;存储容量:64GB,d***1,2019/2/16 11:03,手机不错
1.03525E+12,0,网络类型:无需合约版;机身颜色:银色;套餐类型:官方标配;存储容量:64GB,放***8,2019/2/14 17:24,手机很好
1.0355E+12,0,网络类型:无需合约版;机身颜色:银色;套餐类型:官方标配;存储容量:64GB,拇***宠,2019/2/21 20:02,在苏宁买的第二台手机了，上一部是前年给孩子买的苹果6，至今使用完美。这一台是年三十给自己的奖励，下单后初一下午苏宁快递小哥送上五楼，没有电梯，临走还问家里有没有需要捎下去的垃圾，顺路捎下去，苏宁小哥的服务是越来越好了，真没的说！初一到今天正月十七，已经用了半个多月，功能完美没有出现网上说的各种问题，运行流畅。不足的就是屏幕太大用惯了6S，7，之后用代P的是真不习惯，开车单手根本没办法操作。 看到评价里面很多黑苏宁的，不知道都是些什么人，你们可以把我当托哈，不过苏宁也有需要改进的地方，有事机械性回复，没有人在线。还有就是这么几千四五十块手机你好歹送个膜也行，送个套也可以，都没有送。害得我裸奔几天屏幕出现一丢丢划痕，工作原因，口袋比较脏！后来装备全部配齐，自己也贴上了蓝色的膜！没贴膜以前银色的，看起来也很不错，贴了膜更漂亮，晒一晒，有喷子说是托儿的欢迎开喷！
1.0354E+12,0,网络类型:无需合约版;机身颜色:金色;套餐类型:官方标配;存储容量:64GB,h***5,2019/2/16 22:14,很满意的一次购物
1.0353E+12,0,网络类型:无需合约版;机身颜色:金色;套餐类型:官方标配;存储容量:64GB,j***5,2019/2/18 20:02,使用了几天，手机很好，满意
1.03509E+12,0,网络类型:无需合约版;机身颜色:金色;套餐类型:官方标配;存储容量:64GB,激***归,2019/2/13 20:05,手机到啦苏宁易购的确不错  是正品 都很放心也很安全。安排就完事了
1.03502E+12,0,网络类型:无需合约版;机身颜色:金色;套餐类型:官方标配;存储容量:64GB,i***l,2019/2/14 21:43,犹豫了好几天终于买了～送货很快，各方面都查了，是正品，棒棒哒！之前看评论还有点忐忑，特意用了几天才来评价，挺好的，没啥问题，运行确实流畅，特别开心！
1.0356E+12,0,网络类型:无需合约版;机身颜色:金色;套餐类型:官方标配;存储容量:64GB,r***6,2019/2/19 23:21,目前用起来还不错
1.0353E+12,0,网络类型:无需合约版;机身颜色:银色;套餐类型:官方标配;存储容量:64GB,幽***4,2019/2/18 20:09,很好家人很满意
1.03499E+12,0,网络类型:无需合约版;机身颜色:深空灰色;套餐类型:官方标配;存储容量:64GB,t***7,2019/2/15 23:45,手机挺好用的，很不错，价格实惠.终于收到我需要的宝贝了，东西很好，价美物廉，谢谢掌柜的！说实在，这是我淘宝购物来让我最满意的一次购物。无论是掌柜的态度还是对物品，我都非常满意的。掌柜态度很专业热情，有问必答，回复也很快，我问了不少问题，他都不觉得烦，都会认真回答我，这点我向掌柜表示由衷的敬意，这样的好掌柜可不多。再说宝贝，正是我需要的，收到的时候包装完整，打开后让我惊喜的是，宝贝比我想象中的还要好！不得不得竖起大拇指。下次需要的时候我还会再来的，到时候麻烦掌柜给个优惠哦！
1.03549E+12,0,网络类型:无需合约版;机身颜色:深空灰色;套餐类型:官方标配;存储容量:64GB,t***4,2019/2/20 0:45,没注意看 确认晚了
1.03521E+12,0,网络类型:无需合约版;机身颜色:银色;套餐类型:官方标配;存储容量:64GB,t***3,2019/2/19 8:37,挺好的??第二天就到了
1.03521E+12,0,网络类型:无需合约版;机身颜色:深空灰色;套餐类型:官方标配;存储容量:64GB,岁***者,2019/2/19 10:44,使用不错，后期追评。
1.03524E+12,0,网络类型:无需合约版;机身颜色:深空灰色;套餐类型:官方标配;存储容量:64GB,c***a,2019/2/14 15:47,苏宁易购 可以信赖
1.03467E+12,0,网络类型:无需合约版;机身颜色:深空灰色;套餐类型:官方标配;存储容量:64GB,小***6,2019/2/8 14:07,北京发货 天津转天就到了 是全新未拆封机器 不错 开始不敢在苏宁易购买 以前买手机一直在实体店买的  苏宁易购确实值得相信 因为我好多同事都在这里买电器 还会继续光顾的 必须好评
1.0354E+12,0,网络类型:无需合约版;机身颜色:金色;套餐类型:官方标配;存储容量:64GB,t***5,2019/2/21 21:48,正品，序列号官网了，保修到20年2月20
1.0352E+12,0,网络类型:无需合约版;机身颜色:金色;套餐类型:官方标配;存储容量:64GB,w***i,2019/2/13 20:49,苹果设计的很漂亮，系统也很流畅，很喜欢
1.03509E+12,0,网络类型:无需合约版;机身颜色:深空灰色;套餐类型:官方标配;存储容量:64GB,骄***心,2019/2/15 21:37,大商家，价格合适，发货快，好评。
1.03491E+12,0,网络类型:无需合约版;机身颜色:深空灰色;套餐类型:官方标配;存储容量:64GB,w***6,2019/2/14 18:24,手机收到用了几天才评价的，很不错，好评
1.03524E+12,0,网络类型:无需合约版;机身颜色:深空灰色;套餐类型:官方标配;存储容量:64GB,t***1,2019/2/16 12:00,用了几天 非常不错！
